id,created_at,updated_at,business_profile_id,business_profile_created,business_profile_updated,logo_import_status,name,url,categories,description,headquarters_location,cb_rank,investor_type,investment_stage,number_of_employees,number_of_funding_rounds,funding_status,last_funding_date,last_funding_amount,last_funding_type,total_funding_amount,number_of_lead_investors,number_of_investors,acquisition_status,operating_status
700,,,921,1,0,1,"ASG Technologies Group, Inc.",https://www.crunchbase.com/organization/asg,"Enterprise Software, Software","ASG Technologies brings peace of mind to every enterprise with proven solutions for information access, management and control.","Naples, Florida, United States",38511,,,1001-5000,1,,4/25/2017,,Undisclosed,,1,1,Made Acquisitions,Active
701,,,922,1,0,0,Asgard Technologies,https://www.crunchbase.com/organization/asgard-technologies,Network Security,Asgard Technologies is a network security company.,"Fort Lauderdale, Florida, United States",473721,,,,,M&A,,,,,,,Was Acquired,Active
702,,,923,1,0,1,Ashley's Food Delivery,https://www.crunchbase.com/organization/ashley-s-food-delivery,Food and Beverage,Ashley's Food Delivery offers on-demand delivery and drop-off catering from popular Sarasota restaurants.,"Sarasota, Florida, United States",211586,,,,,M&A,,,,,,,Was Acquired,Active
703,,,924,1,0,1,Ashmere Insurance Co.,https://www.crunchbase.com/organization/ashmere-insurance-co,Insurance,"Ashmere Insurance Co., a workers’ compensation specialty insurance company.","Fort Lauderdale, Florida, United States",190434,,,,,M&A,,,,,,,Was Acquired,Active
704,,,925,1,0,0,Ashtech,https://www.crunchbase.com/organization/ashtech,Consulting,Ashtech is one of the trimble integrated technologies in our electronic world.,"Tallahassee, Florida, United States",419294,,,251-500,,,,,,,,,,Active
705,,,926,1,0,1,Asiseeyou,https://www.crunchbase.com/organization/asiseeyou,"Photo Sharing, Photography, Social Media",Share meme-style images and make it trend.,"Miami, Florida, United States",407670,,,,,,,,,,,,,Active
706,,,927,1,0,0,Ask2Amigo Law Firm,https://www.crunchbase.com/organization/ask2amigo-law-firm,Legal,"Law firm with attorneys in Fort Lauderdale and Tampa, Florida handling personal injury, criminal defense, immigration, and family law cases.","Tampa, Florida, United States",361605,,,,,,,,,,,,,Active
707,,,928,1,0,1,"Aspen Diversified Construction, Inc.",https://www.crunchbase.com/organization/aspen-diversified-construction-inc,,Aspen Diversified Construction offers a portfolio of commercial and residential remodelling services.,"Apopka, Florida, United States",435725,,,,,,,,,,,,,Active
708,,,929,1,0,1,"Aspire Financial Services, LLC",https://www.crunchbase.com/organization/aspire-financial-services-llc,Financial Services,"Aspire Financial Services, LLC is a financial services firm based in Boston.","Tampa, Florida, United States",154502,,,101-250,,,,,,,,,,Active
709,,,930,1,0,1,Assembly Fasteners Inc.,https://www.crunchbase.com/organization/assembly-fasteners-inc,Manufacturing,"Highly trained and knowledgeable staff providing the world with assembly solutions. This includes fasteners, adhesives and abrasives.","Apopka, Florida, United States",378588,,,101-250,,,,,,,,,,Active
710,,,931,1,0,0,Asset Management Advisors,https://www.crunchbase.com/organization/asset-management-advisors,"Financial Services, Wealth Management",Asset Management Advisors is a specialized wealth management firm.,"Jupiter, Florida, United States",478335,,,,,M&A,,,,,,,Was Acquired,Active
711,,,932,1,0,1,AssetX,https://www.crunchbase.com/organization/assetx,"Cryptocurrency, Real Estate Investment",AssetX is a cryptocurrency platform that is based on blockchain technology which is completely anonymous.,"Orlando, Florida, United States",30067,,,Nov-50,1,,11/25/2017,"$1,500,000.00 ",Initial Coin Offering,"$1,500,000.00 ",1,1,,Active
712,,,933,1,0,1,AssistRx,https://www.crunchbase.com/organization/assistrx,"Health Care, Information Technology","AssistRx, Inc provides healthcare information technology solutions to the Specialty Pharmaceutical distribution channel.","Orlando, Florida, United States",80265,,,51-100,,,,,,,,,Made Acquisitions,Active
713,,,934,1,0,0,Associated Composite Inc.,https://www.crunchbase.com/organization/associated-composite-inc,,"ACI, an FAA-licensed repair and overhaul company.","Miami, Florida, United States",526174,,,,,M&A,,,,,,,Was Acquired,Active
714,,,935,1,0,0,Associated Grocers of Florida,https://www.crunchbase.com/organization/associated-grocers-of-florida,Retail,"Associated Grocers of Florida, Inc. is a retailer-owned cooperative distributing full lines of groceries and general merchandise.","Pompano Beach, Florida, United States",227214,,,251-500,,M&A,,,,,,,Was Acquired,Active
715,,,936,1,0,1,Association Financial Services,https://www.crunchbase.com/organization/association-financial-services,Financial Services,Association Financial Services provides accounts receivable services.,"Miami, Florida, United States",400174,,,10-Jan,2,,2/1/2011,,Venture - Series Unknown,,,1,,Active
716,,,937,1,0,1,Association for Software Testing,https://www.crunchbase.com/organization/association-for-software-testing,Association,The Association for Software Testing is dedicated to advancing the understanding of the science and practice of software testing,"Palm Bay, Florida, United States",307225,,,,,,,,,,,,,Active
717,,,938,1,0,1,AssuredPartners,https://www.crunchbase.com/organization/assuredpartners,"Customer Service, Insurance","AssuredPartners, Inc. invests in property and casualty and employee benefits brokerage firms across the country. Our strategy is national","Lake Mary, Florida, United States",78561,,,5001-10000,,M&A,,,,,,,"Made Acquisitions, Was Acquired",Active
718,,,939,1,0,0,AssureSign,https://www.crunchbase.com/organization/assuresign,Software,"AssureSign is a web-hosted service that facilitates the managed processing of documents in an all-digital, high-security environment.","Altamonte Springs, Florida, United States",91539,,,51-100,,,,,,,,,,Active
719,,,940,1,0,1,AST&Science,https://www.crunchbase.com/organization/ast-science,Telecommunications,AST Team is designing the disrupting next generation of wireless access technology.,"Miami, Florida, United States",163011,,,,,,,,,,,,Made Acquisitions,Active
720,,,941,1,0,1,ASTQB,https://www.crunchbase.com/organization/astqb,"Computer, Software",The mission of the ASTQB is to promote professionalism in software testing in the United States.,"Tampa, Florida, United States",291723,,,10-Jan,,,,,,,,,,Active
721,,,942,1,0,1,AstriaLearning,https://www.crunchbase.com/organization/astrialearning,"EdTech, Education, Information Technology",Edtech. IT. Everything you need to effectively run your educational institution.,"Tampa, Florida, United States",220708,,,Nov-50,,,,,,,,,,Active
722,,,943,1,0,1,Astro Air Inc.,https://www.crunchbase.com/organization/astro-air-inc,Home Improvement,"Astro Air Inc. is a Commercial and Residential AC company in Boynton Beach, FL.","Boynton Beach, Florida, United States",355570,,,Nov-50,,,,,,,,,,Active
723,,,944,1,0,1,Astute Recruit USA,https://www.crunchbase.com/organization/astute-recruit-usa,,"Here at Astute Recruit USA, we believe that communication is the key to obtaining optimal results.","Tampa, Florida, United States",461417,,,10-Jan,,,,,,,,,,Active
724,,,945,1,0,0,AT&T,https://www.crunchbase.com/organization/at-t-wireless-and-directv,"Internet, Mobile Devices, Telecommunications",Our authorized AT&T and DIRECTV retail store in St. Augustine will take care of all of your telecommunication and electronic needs!,"Saint Augustine, Florida, United States",292587,,,,,,,,,,,,,Active
725,,,946,1,0,1,Atchley Realty,https://www.crunchbase.com/organization/atchley-realty,"Real Estate, Sports",Atchley Realty is an international real estate company that focuses on luxury homes.,"Sarasota, Florida, United States",370858,,,10-Jan,,,,,,,,,,Active
726,,,947,1,0,1,Atenda Healthcare Solutions,https://www.crunchbase.com/organization/atenda-healthcare-solutions,,"Atenda Healthcare Solutions provides physicians, hospitals and health plans a single point of contact for the coordination of care through","Miramar Beach, Florida, United States",154896,,,Nov-50,,M&A,,,,,,,Was Acquired,Active
727,,,948,1,0,1,Athena Bitcoin,https://www.crunchbase.com/organization/athena-bitcoin,Financial Services,Athena Bitcoin is a provider of ATM network services.,"Miami, Florida, United States",63052,,,,,,,,,,,,Made Acquisitions,Active
728,,,949,1,0,0,Athlete's Clinic,https://www.crunchbase.com/organization/athlete-s-clinic,,Athlete's Clinic is a one-stop medical and performance centre catering to the the needs of individual athletes and team sports in Singapore.,"Plantation, Florida, United States",329550,,,,,,,,,,,,,Active
729,,,950,1,0,1,AthletePromotions.com,https://www.crunchbase.com/organization/athletepromotions-com,"Digital Marketing, Marketing, Sports","AthletePromotions, a sports marketing agency and speakers bureau, books athletes, celebrities, and sports figures for speaking engagements.","Winter Garden, Florida, United States",123308,,,,,,,,,,,,,
730,,,951,1,0,1,Athletes Performance Gear,https://www.crunchbase.com/organization/athletes-performance-gear,Sporting Goods,We sell products for fitness minded individuals,"Palm Harbor, Florida, United States",284128,,,10-Jan,1,Seed,11/14/2014,,Angel,,,,,Active
731,,,952,1,0,0,"ATI Medical, Inc.",https://www.crunchbase.com/organization/ati-medical-inc,"Manufacturing, Medical",ATI Medical is a company that specializes in medical equipment distribution to physicians and health care professionals.,"Miami, Florida, United States",307125,,,10-Jan,,,,,,,,,,Active
732,,,953,1,0,1,ATILUS,https://www.crunchbase.com/organization/atilus,"Developer Tools, E-Commerce, Email Marketing, SEO, Web Design, Web Development, Web Hosting",Internet Marketing Web Development,"Bonita Springs, Florida, United States",220411,,,10-Jan,,,,,,,,,,Active
733,,,954,1,0,0,Atlantic Ocean Realty,https://www.crunchbase.com/organization/atlantic-ocean-realty,Consulting,Atlantic Ocean Realty is a company specializing in home sales along the coasts of Florida.,"Palm Coast, Florida, United States",406107,,,Nov-50,,,,,,,,,,Active
734,,,955,1,0,1,Atlantic Precision,https://www.crunchbase.com/organization/atlantic-precision,"3D Printing, 3D Technology, Aerospace, Manufacturing","Atlantic Precision is a premier Aerospace Machining, Design & Build facility.","Port St. Lucie, Florida, United States",176381,,,51-100,,M&A,,,,,,,Was Acquired,Active
735,,,956,1,0,0,Atlantic Radio Corporation,https://www.crunchbase.com/organization/atlantic-radio-corporation,,"Atlantic Radio Corporation is providving the sales, rentals, repairs and expert installation services of 2 way radios in South Florida.","Fort Lauderdale, Florida, United States",431871,,,,,,,,,,,,,Active
736,,,957,1,0,1,Atlantic.Net,https://www.crunchbase.com/organization/atlantic-net,"Cloud Computing, Cloud Infrastructure, Web Hosting","Atlantic.Net is a business cloud hosting company that offers on-demand, HIPAA compliant, and dedicated hosting.","Orlando, Florida, United States",135033,,,,,,,,,,,,,
737,,,958,1,0,1,atlanticOptimize,https://www.crunchbase.com/organization/atlanticoptimize,"Advertising, Consulting, Internet, SEO",atlanticOptimize provides internet marketing and consulting for small to medium businesses.,"West Palm Beach, Florida, United States",444655,,,10-Jan,,,,,,,,,,Active
738,,,959,1,0,1,Atlas Southeast Papers,https://www.crunchbase.com/organization/atlas-southeast-papers,"Manufacturing, Recycling",A portfolio company of Peak Rock Capital,"Sanford, Florida, United States",150969,,,Nov-50,,,,,,,,,Made Acquisitions,Active
739,,,960,1,0,1,Atlas Spine,https://www.crunchbase.com/organization/atlas-spine,"Biotechnology, Health Care, Medical Device",Atlas Spine develops and markets spinal implants and instrument systems.,"Jupiter, Florida, United States",50612,,,Nov-50,1,,3/18/2011,"$3,500,000.00 ",Venture - Series Unknown,"$3,500,000.00 ",,,,Active
740,,,961,1,0,1,Atmosphere,https://www.crunchbase.com/organization/atmosphere,"Apps, Mobile, Nightlife, Video",Atmosphere is a mobile App that is revolutionizing the $26B nightlife industry,"Tampa, Florida, United States",51547,,,10-Jan,2,Seed,5/13/2016,"$75,000.00 ",Angel,"$125,000.00 ",,,,Active
741,,,962,1,0,0,Atnight,https://www.crunchbase.com/organization/atnight,"Nightlife, SaaS, Software",Nightlife marketing & photography,"Miami, Florida, United States",182395,,,Nov-50,,,,,,,,,,Active
742,,,963,1,0,1,Atris Technology,https://www.crunchbase.com/organization/atris-technology,"Automotive, Banking, Software, Virtualization",Atris Technology is a Financial software for teller automation and branch banking.,"Gainesville, Florida, United States",221364,,,,,,,,,,,,,Active
743,,,964,1,0,1,Attico Concepts Window Treatments,https://www.crunchbase.com/organization/attico-concepts-window-treatments,,We specialize in the design and customization of Custom Window Treatments in Miami. At Attico Concepts we are all about creating the right,"Miami, Florida, United States",390734,,,Nov-50,,,,,,,,,,Active
744,,,965,1,0,0,Attitude Network,https://www.crunchbase.com/organization/attitude-network,Publishing,Attitude Network publishes online entertainment web sites.,"Naples, Florida, United States",534130,,,,,M&A,,,,,,,Was Acquired,Active
745,,,966,1,0,1,Attorney Rehabilitation Group,https://www.crunchbase.com/organization/attorney-rehabilitation-group,Law Enforcement,A Online Reputation Management for Lawyers,"Miami, Florida, United States",34716,,,,1,,4/12/2018,"$5,000,000.00 ",Venture - Series Unknown,"$5,000,000.00 ",,,,Active
746,,,967,1,0,0,Attorneys' Title Services,https://www.crunchbase.com/organization/attorneys-title-services,,"Attorneys' Title Services is an attorney-operated title insurance that offers closing services to realtors, builders, and lenders.","Jacksonville, Florida, United States",306838,,,Nov-50,,,,,,,,,,Active
747,,,968,1,0,1,Aubrey Organics UK,https://www.crunchbase.com/organization/aubrey-organics-uk,"Consumer, Manufacturing","Natural Beauty, Hair & Skincare Products","Tampa, Florida, United States",322846,,,,,M&A,,,,,,,Was Acquired,Active
748,,,969,1,0,1,Auction123 Inc,https://www.crunchbase.com/organization/auction123-inc,,"Dealer Website Development, Vehicle Inventory Management, Online Inventory Marketing Solutions, 24/7 Customer Support","Weston, Florida, United States",154887,,,51-100,,M&A,,,,,,,Was Acquired,Active
749,,,970,1,0,0,Audi Jacksonville,https://www.crunchbase.com/organization/audi-jacksonville,,Audi Jacksonville is a car dealership that sells new and pre-owned Audi cars.,"Jacksonville, Florida, United States",338364,,,Nov-50,,,,,,,,,,Active
750,,,971,1,0,1,Audi South Orlando,https://www.crunchbase.com/organization/audi-south-orlando,,"Audi South Orlando is an Audi dealer operating in Orlando. Visit us today for the best selection of Audi vehicles in the Orlando, FL area.","Orlando, Florida, United States",459113,,,10-Jan,,,,,,,,,,Active
751,,,972,1,0,1,Audigence,https://www.crunchbase.com/organization/audigence,"Biotechnology, Medical, Medical Device",Audigence provides a technology solution to evaluate hearing device performance for individuals with hearing loss.,"Melbourne Beach, Florida, United States",71844,,,10-Jan,1,,7/26/2010,"$9,500,000.00 ",Venture - Series Unknown,"$9,500,000.00 ",,,,Active
752,,,973,1,0,1,Audimated,https://www.crunchbase.com/organization/audimated,Music,"Audimated is an online music community that helps artists and fans share, discover, and monetize music.","Miami, Florida, United States",222415,,,10-Jan,,,,,,,,,,Active
753,,,974,1,0,1,Audio Formula,https://www.crunchbase.com/organization/audio-formula,,"The professional audio industry with its legendary line source systems, developing a reputation.","Miami, Florida, United States",338152,,,10-Jan,,,,,,,,,,Active
754,,,975,1,0,0,"Audio Messaging Solutions, LLC",https://www.crunchbase.com/organization/audio-messaging-solutions-llc,"Advertising, Audio, Messaging","Mitchell Keller founded Conquest Communications Inc. in 1986 to provide high quality business audio services. In January 2002, Aaron","Oldsmar, Florida, United States",156518,,,51-100,,M&A,,,,,,,Was Acquired,Active
755,,,976,1,0,1,Audition Inside,https://www.crunchbase.com/organization/audition-inside,"Art, Employment",Audition Inside is a national audition search service for artists.,"Orlando, Florida, United States",413689,,,10-Jan,,,,,,,,,,Active
756,,,977,1,0,1,Auditmacs.com,https://www.crunchbase.com/organization/auditmacs-com,"Information Services, Information Technology",Auditmacs is an industry leader because of its ability to deliver consistent results,"Jacksonville, Florida, United States",204435,,,,,,,,,,,,,Active
757,,,978,1,0,1,Auditz,https://www.crunchbase.com/organization/auditz,"Enterprise Software, Health Care, Software",Auditz is a healthcare services organization that uses sophisticated proprietary technology to help healthcare providers.,"Tampa, Florida, United States",117308,,,,,,,,,,,,,
758,,,979,1,0,0,Augment Systems Inc,https://www.crunchbase.com/organization/augment-systems-inc,Web Development,"Augment Systems, Inc is a development stage company, designs, develops and sells high-end super server products.","Boca Raton, Florida, United States",567665,,,,,IPO,,,,,,,,Active
759,,,980,1,0,1,AuraPortal,https://www.crunchbase.com/organization/auraportal,"Analytics, Business Intelligence, Cloud Computing, CRM, Enterprise Software, Predictive Analytics, Software","AuraPortal is a visionary iBPM software company with a passion to spark innovation, optimize businesses and empower digital transformation.","Miami, Florida, United States",101701,,,251-500,,,,,,,,,,Active
760,,,981,1,0,1,Aurora,https://www.crunchbase.com/organization/aurora,Music,Rediscover your surroundings like never before.,"Jacksonville, Florida, United States",75383,,,10-Jan,,,,,,,,,,Active
761,,,981,0,1,,Aurora,https://www.crunchbase.com/organization/aurora-2,"Advertising, Enterprise Software, Marketing Automation","Aurora is a boutique software development firm that helps small and agile teams conceptualize, build, and launch awesome products.","Beverly Hills, Florida, United States",160630,,,Nov-50,,,,,,,,,,Active
762,,,982,1,0,1,Aurora Diagnostics,https://www.crunchbase.com/organization/aurora-diagnostics,"Biotechnology, Health Care, Hospital","Aurora Diagnostics is a specialized laboratory company dedicated to providing unsurpassed diagnostic, prognostic, and therapeutic.","Palm Beach Gardens, Florida, United States",105650,,,1001-5000,1,Private Equity,6/2/2006,,Private Equity,,,1,Made Acquisitions,Active
763,,,983,1,0,0,Aurora Semiconductor,https://www.crunchbase.com/organization/aurora-semiconductor,,Aurora Semiconductor Wafer Foundry and Packaging Services are focused on technology development and processing needs.,"Saint Petersburg, Florida, United States",170655,,,Nov-50,,,,,,,,,,Active
764,,,984,1,0,1,Aurus Software,https://www.crunchbase.com/organization/aurus-software,"Enterprise Software, Software",Aurus Enterprise Service Center is a platform for managing IT Services and Business Processes.,"Coral Gables, Florida, United States",323582,,,,,,,,,,,,,Active
765,,,985,1,0,1,AuthenTec,https://www.crunchbase.com/organization/authentec,"Biometrics, Cyber Security, Identity Management, NFC, Security, Semiconductor, Sensor","AuthenTec is a tech security company providing computer and mobile safety, identity management, biometrics, and touch control solutions.","Melbourne Beach, Florida, United States",61218,,,101-250,4,M&A,7/3/2004,"$15,000,000.00 ",Series D,"$50,000,000.00 ",2,12,"Made Acquisitions, Was Acquired",Active
766,,,986,1,0,1,Authentic Jobs,https://www.crunchbase.com/organization/authentic-jobs,Internet,"Authentic Jobs is a targeted destination for web and creative professionals, and the companies seeking to hire them.","Sarasota, Florida, United States",171692,,,10-Jan,,,,,,,,,,Active
767,,,987,1,0,1,Authentium,https://www.crunchbase.com/organization/authentium,"E-Commerce, SaaS, Security",Authentium provides security software enabling e-commerce by uniting users and websites in an end-to-end secured transaction environment.,"Palm Beach Gardens, Florida, United States",96622,,,251-500,2,M&A,4/1/2007,"$6,000,000.00 ",Series B,"$21,000,000.00 ",,6,Was Acquired,Closed
768,,,988,1,0,1,AuthenWare,https://www.crunchbase.com/organization/authenware,"Cyber Security, Security, Software",AuthenWare Corporation is a leading cybersecurity software provider.,"Miami, Florida, United States",168302,,,Nov-50,,,,,,,,,,Active
769,,,989,1,0,1,Auto Auction Mall,https://www.crunchbase.com/organization/auto-auction-mall,Online Auctions,Auto Auction Mall LLC is an online vehicle marketplace featuring inventory from all of the major US used and salvage vehicle auctions.,"Miami, Florida, United States",32241,,,10-Jan,1,Seed,9/15/2015,"$500,000.00 ",Seed,"$500,000.00 ",,,,Active
770,,,990,1,0,1,Auto Data Direct,https://www.crunchbase.com/organization/auto-data-direct,Information Technology,Auto Data Direct provides real-time access to DMV data,"Tallahassee, Florida, United States",128285,,,,,,,,,,,,,
771,,,991,1,0,1,Auto Glass America - Tampa,https://www.crunchbase.com/organization/auto-glass-america-tampa,,"We provide an extensive list of windshield and auto glass replacement services throughout Tampa, Florida.","Tampa, Florida, United States",327936,,,Nov-50,,,,,,,,,,Active
772,,,992,1,0,1,Auto Parts Network®,https://www.crunchbase.com/organization/auto-parts-network,"Automotive, E-Commerce, Marketing Automation, Software",Auto Parts Network® provides auto replacement and performance parts, accessories, wheels and tires, car audio, and car care products.,"Boca Raton, Florida, United States",92477,,,Nov-50,,,,,,
773,,,993,1,0,1,Auto Transport Leads,https://www.crunchbase.com/organization/auto-transport-leads-2,,Auto transport sales consulting sales leads,"Orlando, Florida, United States",456029,,,,,,,,,,,,,Active
774,,,994,1,0,1,Auto-power,https://www.crunchbase.com/organization/auto-power,Apps,Auto-Power is an online platform that enables users to track and improve their gas and insurance consumption.,"Lake Mary, Florida, United States",471995,,,,,,,,,,,,,Active
775,,,995,1,0,1,Autobrain,https://www.crunchbase.com/organization/autobrain,Automotive,Autobrain provides safety and security for families while reducing the cost of operating and maintaining their vehicles.,"Boca Raton, Florida, United States",85796,,,Nov-50,,,,,,,,,,Active
776,,,996,1,0,1,AUTOBUY,https://www.crunchbase.com/organization/autobuy,,A CAR BUYING COMPANY,"West Palm Beach, Florida, United States",76145,,,,1,Seed,7/15/2010,"$40,000.00 ",Seed,"$40,000.00 ",,,,Active
777,,,997,1,0,0,"AutoFuse, Inc.",https://www.crunchbase.com/organization/autofuse-inc,Web Development,"AutoFuse, Inc. is a web site development solutions company.","Fort Lauderdale, Florida, United States",435964,,,,,M&A,,,,,,,Was Acquired,Active
778,,,998,1,0,1,AutoGalaxies at BorSystems,https://www.crunchbase.com/organization/autogalaxies-at-borsystems,"Automotive, Classifieds, Internet, Search Engine",For All Car Enthusiasts,"Boca Raton, Florida, United States",375807,,,10-Jan,,,,,,,,,,Active
779,,,999,1,0,1,AutoGro,https://www.crunchbase.com/organization/autogro,Consulting,AUTOGRO is Florida’s Premier Group Purchasing Organization (GPO) exclusively for New Car Dealerships.,"Miami Lakes, Florida, United States",193014,,,,,,,,,,,,,Active
780,,,1000,1,0,0,Autohire Software,https://www.crunchbase.com/organization/autohire-software,,applicant tracking system,"Orlando, Florida, United States",332357,,,Nov-50,,M&A,,,,,,,Was Acquired,Active
781,,,1001,1,0,1,AutoLeadStar,https://www.crunchbase.com/organization/autoleadstar,,AI Retail Engagement for Automotive Dealerships,"Miami, Florida, United States",106870,,,Nov-50,,,,,,,,,,Active
782,,,1002,1,0,1,AutoLoop,https://www.crunchbase.com/organization/autoloop,"Advertising, Marketing",AutoLoop is a marketing and advertising company that provides automotive marketing software solutions.,"Clearwater, Florida, United States",138108,,,,,,,,,,,,,
783,,,1003,1,0,1,Automated Medical Assistant,https://www.crunchbase.com/organization/automated-medical-assistant,"Scheduling, Software",Automated Medical Assistant is an online billing program created to handle various shades of therapy practices of psychology and psychiatry.,"Pompano Beach, Florida, United States",350742,,,10-Jan,,,,,,,,,,Active
784,,,1004,1,0,0,Automated Merchant Services,https://www.crunchbase.com/organization/automated-merchant-services,Commercial,Automated Merchant Services provides electronic merchant payment services to businesses and government agencies.,"Coral Springs, Florida, United States",526323,,,,,M&A,,,,,,,Was Acquired,Active
785,,,1005,1,0,1,AutomatedCalls,https://www.crunchbase.com/organization/automatedcalls,Public Relations,"Easy, Free Mass Notification System","Jupiter, Florida, United States",506395,,,Nov-50,,,,,,,,,,Active
786,,,1006,1,0,1,Automize It,https://www.crunchbase.com/organization/automize-it,"Mobile, SaaS, Semantic Web, Software",Automize: Automate. Systemize. Optimize.,"Boca Raton, Florida, United States",228825,,,10-Jan,,,,,,,,,,Active
787,,,1007,1,0,1,AutoNation,https://www.crunchbase.com/organization/autonation,"Automotive, Customer Service, Retail",Welcome to AutoNation. Over 43 Million Happy Customers have trusted us when buying or servicing their cars and trucks.,"Fort Lauderdale, Florida, United States",63538,,,10001+,,IPO,,,,,,,Made Acquisitions,Active
