id,created_at,updated_at,business_profile_id,business_profile_created,business_profile_updated,logo_import_status,name,url,categories,description,headquarters_location,cb_rank,investor_type,investment_stage,number_of_employees,number_of_funding_rounds,funding_status,last_funding_date,last_funding_amount,last_funding_type,total_funding_amount,number_of_lead_investors,number_of_investors,acquisition_status,operating_status
1,,,225,1,0,1,"Cramer, Johnson, Wiggins & Associates (CJW & Associates)",https://www.crunchbase.com/organization/cramer-johnson-wiggins-associates-cjw-associates,Office Administration,A leading independent adjusting and claims management company.,"Orlando, Florida, United States",352032,,,,,,,,,,,,,Active
2,,,226,1,0,1,".decimal, Inc.",https://www.crunchbase.com/organization/decimal-inc,Medical Device,.decimal is a medical devices company providing radiation therapy devices.,"Sanford, Florida, United States",210774,,,101-250,,,,,,,,,,Active
3,,,227,1,0,1,(ISC)2 - Tampa Bay Chapter,https://www.crunchbase.com/organization/isc-2-tampa-bay-chapter,Association,A registered 501(c)3 organization which provides it’s members with the opportunity to build a local network of peers,"Tampa, Florida, United States",435887,,,,,,,,,,,,,Active
4,,,228,1,0,0,@TravelDeals,https://www.crunchbase.com/organization/traveldeals,"Advertising, Automotive, Career Planning, Local, Travel",@TravelDeals is a group of people who find and share travel deals from around the globe.,"Fort Lauderdale, Florida, United States",205029,,,10-Jan,,,,,,,,,,Active
5,,,229,1,0,1,0Lat,https://www.crunchbase.com/organization/0lat,Web Development,0Lat is Provide Development Services.,"Orlando, Florida, United States",465682,,,,,,,,,,,,,Active
6,,,230,1,0,1,0NL9,https://www.crunchbase.com/organization/0nl9,"Cloud Computing, Small and Medium Businesses, Training","0NL9, Inc. is a Google Premier Partner and one of the best Cloud Computing Companies in Miami.","Miami, Florida, United States",285039,,,10-Jan,,,,,,,,,,Active
7,,,231,1,0,0,1 Nation Technology,https://www.crunchbase.com/organization/1-nation-technology,Telecommunications,1 Nation Technology is a Telecommunications company.,"Oldsmar, Florida, United States",555229,,,,,M&A,,,,,,,Was Acquired,Active
8,,,232,1,0,1,1.618 Technology,https://www.crunchbase.com/organization/1-618-technology,"Real Estate, SEM, Web Hosting",Home & Condo Gallery is a real estate search portal.,"Naples, Florida, United States",208005,,,10-Jan,1,,1/22/2014,,Equity Crowdfunding,,,,,Active
9,,,233,1,0,0,10East,https://www.crunchbase.com/organization/10east,Web Hosting,10East is engaged in the development and hosting of business intelligence platforms.,"Jacksonville, Florida, United States",518147,,,Nov-50,,M&A,,,,,,,Was Acquired,Active
10,,,234,1,0,1,110% Play Harder.,https://www.crunchbase.com/organization/110-play-harder,,110% is a performance wear company that specialized in giving athletes the gear they need to succeed.,"Jacksonville Beach, Florida, United States",272325,,,Nov-50,,,,,,,,,,Active
11,,,235,1,0,1,1111 Industries,https://www.crunchbase.com/organization/1111-industries,Manufacturing,All Other Plastics Product Manufacturing.,"Largo, Florida, United States",516153,,,10-Jan,,,,,,,,,,Active
12,,,236,1,0,1,123 Employee Co,https://www.crunchbase.com/organization/123-employee-co,,The best and the most affordable way to outsource your services to the most skillful people in the Philippines,"Hollywood, Florida, United States",329274,,,,,,,,,,,,,Active
13,,,237,1,0,0,123 FRUTTY,https://www.crunchbase.com/organization/123-frutty,"Apps, Brand Marketing, Education","123 Frutty is a fashion brand for babies, toddlers & kids.","Orlando, Florida, United States",328149,,,10-Jan,,,,,,,,,,Active
14,,,238,1,0,1,123Deals.com,https://www.crunchbase.com/organization/123deals-com,,"123Deals is a France-based social group service that offers search engine promotions, coupons, and local discounts.","Kenansville, Florida, United States",158561,,,10-Jan,,,,,,,,,,Active
15,,,239,1,0,0,123GOink.com,https://www.crunchbase.com/organization/123goink-com,"Consumer Electronics, Hardware, Information Technology, Music, Software",123Goink is a website that provides ink and toner at a discount.,"Lady Lake, Florida, United States",365877,,,10-Jan,,,,,,,,,,Active
16,,,240,1,0,1,123lumpsum,https://www.crunchbase.com/organization/123lumpsum,,A  specialty finance company that applies institutional financing.,"Fort Lauderdale, Florida, United States",329471,,,101-250,,,,,,,,,,Active
17,,,241,1,0,1,12th Avenue Graphics,https://www.crunchbase.com/organization/12th-avenue-graphics,Printing,Commercial and digital printing firm.,"Miami, Florida, United States",453870,,,10-Jan,,,,,,,,,,Active
18,,,242,1,0,0,13 Guys Named Ed,https://www.crunchbase.com/organization/13-guys-named-ed,"Web Design, Web Development",13 Guys Named Ed is an IT consulting firm which specializes in providing support and security for multiple types of office technology.,"Safety Harbor, Florida, United States",368748,,,10-Jan,,,,,,,,,,Active
19,,,243,1,0,1,1308 Productions,https://www.crunchbase.com/organization/1308-productions,Non Profit,1308 Productions is an independent non-profit organization devoted to public service and music education.,"Miami, Florida, United States",369361,,,10-Jan,,,,,,,,,,Active
20,,,244,1,0,0,1347 Property Insurance Holdings,https://www.crunchbase.com/organization/1347-property-insurance-holdings,Finance,"The Company’s insurance offerings currently include homeowners’ insurance, manufactured home insurance and dwelling fire insurance.","Tampa, Florida, United States",210940,,,501-1000,,IPO,,,,,,,,Active
21,,,245,1,0,1,169 ST.,https://www.crunchbase.com/organization/169-st,"Film, Media and Entertainment, Social",169 ST.,"Lake Mary, Florida, United States",149240,,,,,,,,,,,,,
22,,,246,1,0,0,1800 notify,https://www.crunchbase.com/organization/1800-notify,"Health Care, Medical, Service Industry",1-800 Notify supplies a wide range of healthcare communication services to help you delight and engage your patients.,"Miami, Florida, United States",196849,,,10-Jan,,,,,,,,,,Active
23,,,247,1,0,1,1800 PetMeds,https://www.crunchbase.com/organization/1800-petmeds,E-Commerce,"At PetMeds we love your pets. Follow us to see pins about products we love, helpful pet resources, and of course cute pet photos.","Pompano Beach, Florida, United States",42323,,,101-250,1,IPO,11/11/2016,"$231,000.00 ",Post-IPO Equity,"$231,000.00 ",,1,,Active
24,,,248,1,0,1,1CLick3dPrint,https://www.crunchbase.com/organization/1click3dprint,,Miami gets its own 3D printing services provider! Approach 1Click3DPrint for 3D Design prototyping in Miami.,"Miami, Florida, United States",333170,,,Nov-50,,,,,,,,,,Active
25,,,249,1,0,1,1Sale formerly 1SaleADay,https://www.crunchbase.com/organization/1saleaday,"Coupons, E-Commerce, Fashion, Jewelry, Wireless",1Sale is an online e-commerce website that offers daily deals for products ranging from computer-related products to magazine subscriptions.,"Miami Lakes, Florida, United States",80893,,,51-100,,,,,,,,,,Active
26,,,250,1,0,1,1st BridgeHouse,https://www.crunchbase.com/organization/1st-bridgehouse,"Advice, Financial Services","Dedicated to bringing together ideas, people and resources from across the financial spectrum.","Miami, Florida, United States",448544,,,,,,,,,,,,,Active
27,,,251,1,0,1,1st Merchant Funding,https://www.crunchbase.com/organization/1st-merchant-funding,"Financial Services, FinTech",1st Merchant Funding (1MF) is a leading Merchant Cash Advance and Bank Revenue provider,"Miami, Florida, United States",35925,,,1001-5000,1,,5/7/2014,"$10,000,000.00 ",Debt Financing,"$10,000,000.00 ",,1,,Active
28,,,252,1,0,0,1st United Bancorp,https://www.crunchbase.com/organization/1st-united-bancorp,Banking,"1st United Bank is a Florida State chartered, Federal Reserve member, community bank with locations throughout the South Florida,","Boca Raton, Florida, United States",547244,,,251-500,,M&A,,,,,,,Was Acquired,Active
29,,,253,1,0,0,1stpagelocal,https://www.crunchbase.com/organization/1stpagelocal,Consulting,"I am blessed and lucky to be ME, to love and be be loved by an awesome family, and to be able to empower others for my work.","Florida, United States, North America",547609,,,10-Jan,,,,,,,,,,Active
30,,,254,1,0,1,2 Dollar Delivery,https://www.crunchbase.com/organization/2-dollar-delivery,"Food and Beverage, Food Delivery",2 Dollar Delivery operates as a multiple restaurant delivery company.,"Gainesville, Florida, United States",166559,,,,,M&A,,,,,,,Was Acquired,Active
31,,,255,1,0,0,20th Century Records,https://www.crunchbase.com/organization/20th-century-records,,20th Century Records offers a wide variety of quality 78s at reasonable prices,"Crawfordville, Florida, United States",450090,,,10-Jan,,,,,,,,,,Active
32,,,256,1,0,1,21st Century Care Providers,https://www.crunchbase.com/organization/21st-century-care-providers,"Consulting, Health Care, Home Health Care",21st Century Care Providers is a company that trains clients on how to start and run their own home health care service.,"Bradenton, Florida, United States",298742,,,Nov-50,,,,,,,,,,Active
33,,,257,1,0,1,21st Century Oncology,https://www.crunchbase.com/organization/21st-century-oncology,"Health Care, Medical, Service Industry","21st Century Oncology is the premier provider of cancer care services across multiple modalities, the largest radiation oncology provider","Fort Myers, Florida, United States",15727,,,1001-5000,1,IPO,9/26/2014,"$325,000,000.00 ",Private Equity,"$325,000,000.00 ",1,1,,Active
34,,,258,1,0,0,22 Days Nutrition,https://www.crunchbase.com/organization/22days-nutrition,E-Commerce,22 days is a company that delivers healthy products.,"Miami, Florida, United States",85752,,,Nov-50,,,,,,,,,,Active
35,,,259,1,0,1,24 Hour Pro Muscle Gym,https://www.crunchbase.com/organization/24-hour-pro-muscle-gym,Sports,My company is a gym which is opened 24 hours a day. It has the best equipment and the best service for the money.,"Rockledge, Florida, United States",316907,,,10-Jan,1,,10/23/2014,,Equity Crowdfunding,,,,,Active
36,,,260,1,0,1,249Labs Inc,https://www.crunchbase.com/organization/249labs-inc,"Apps, Consulting, Internet, Mobile","Marketing Technology Consulting & App startup based in Tampa, FL","Tampa, Florida, United States",199159,,,10-Jan,,,,,,,,,,Active
37,,,261,1,0,1,2Go Media,https://www.crunchbase.com/organization/2go-media,Internet,Internet technology company,"Fort Lauderdale, Florida, United States",210631,,,Nov-50,,M&A,,,,,,,Was Acquired,Active
38,,,262,1,0,1,2nd Century,https://www.crunchbase.com/organization/2nd-century,"Internet, Service Industry, Telecommunications","2nd Century Communications, an open network application service provider.","Tampa, Florida, United States",213071,,,,1,,5/16/2000,"$75,000,000.00 ",Venture - Series Unknown,"$75,000,000.00 ",,7,,Active
39,,,263,1,0,1,3 IQs,https://www.crunchbase.com/organization/3-iqs,"Advertising, iOS",3 IQs is a digital marketing company which offers many web development services.,"Orlando, Florida, United States",408402,,,10-Jan,,,,,,,,,,Closed
40,,,264,1,0,1,3 LIttle Birds Interactive LLC,https://www.crunchbase.com/organization/3-little-birds-interactive-llc,,3 Little Birds Interactive is an agency specializing in online marketing staffing and consulting.,"Wauchula, Florida, United States",229435,,,10-Jan,,,,,,,,,,Active
41,,,265,1,0,1,3 Palms Hotels & Resorts,https://www.crunchbase.com/organization/3-palms-hotels-resorts,Hotel,A new way for you to travel and stay in extraordinary independent and condo-hotels.,"Kissimmee, Florida, United States",310906,,,Nov-50,,M&A,,,,,,,Was Acquired,Active
42,,,266,1,0,1,31West Global Services,https://www.crunchbase.com/organization/ramshyam,"Information Technology, Outsourcing",Tech support outsource | Help desk service | Call center outsourcing,"Sarasota, Florida, United States",229676,,,51-100,,,,,,,,,,Active
43,,,267,1,0,1,35CashLoan.Com,https://www.crunchbase.com/organization/35cashloan-com,Financial Services,"At 35cashloan.com we understand, people need our help when no other method of getting cash work for them.","Miami, Florida, United States",527471,,,10-Jan,,,,,,,,,,Active
44,,,268,1,0,1,360 Fire,https://www.crunchbase.com/organization/360-fire,Social Media,360 Fire is a social networking site specifically for firefighters.,"Boca Raton, Florida, United States",407098,,,,,M&A,,,,,,,Was Acquired,Active
45,,,269,1,0,1,360 Healthcare Staffing,https://www.crunchbase.com/organization/360-healthcare-staffing,,"Healthcare Staffing, Nurse Leadership, Interim Nurse Leadership, Long Term Care Staffing, Nursing Home Staffing","Tampa, Florida, United States",199370,,,251-500,,,,,,,,,,Active
46,,,270,1,0,1,"360Converge, Inc",https://www.crunchbase.com/organization/360converge-inc,,360Converge is a unified communication app as a Service (CaaS) for the automotive industry.,"Orlando, Florida, United States",427201,,,10-Jan,,,,,,,,,,Active
47,,,271,1,0,1,"360fly, Inc.",https://www.crunchbase.com/organization/360fly-inc,"Consumer Electronics, Software, Video","360fly, Inc. creates products and software for interactive 360º video experiences.","Florida, United States, North America",8658,,,101-250,3,Late Stage Venture,5/5/2016,"$40,000,000.00 ",Series C,"$59,752,000.00 ",2,4,,Active
48,,,272,1,0,1,3Axis Development,https://www.crunchbase.com/organization/3axis-development-inc,"3D Printing, 3D Technology, Manufacturing",3axis development is a additive manufacturing & short run manufacturing services.,"Boynton Beach, Florida, United States",193431,,,,,,,,,,,,,Active
49,,,273,1,0,1,"3B Medical, Inc.",https://www.crunchbase.com/organization/3b-medical-inc,"Health Diagnostics, Home Health Care, Medical, Medical Device, Personal Health","3B Medical, Inc. is a producer of medical devices for those who suffer from sleep disordered breathing. They are based in Winter Haven, FL.","Winter Haven, Florida, United States",119446,,,,,,,,,,,,,
50,,,274,1,0,1,3C innovate,https://www.crunchbase.com/organization/3c-innovate,Real Estate,3Ci is a real estate development company that specializes in sustainable housing construction.,"Miami, Florida, United States",405684,,,Nov-50,,,,,,,,,,Active
51,,,275,1,0,1,3Cinteractive,https://www.crunchbase.com/organization/3c-interactive,"Marketing Automation, Mobile",Enhancing the Customer Experience Through Mobile Marketing Services,"Boca Raton, Florida, United States",18714,,,101-250,1,,3/1/2011,"$6,000,000.00 ",Debt Financing,"$6,000,000.00 ",,,Made Acquisitions,Active
52,,,276,1,0,1,3D Custom Collagen,https://www.crunchbase.com/organization/3d-custom-collagen,Biotechnology,3D Custom Collagen is a biotechnology company.,"Stuart, Florida, United States",399939,,,,,,,,,,,,,Active
53,,,277,1,0,1,3D Eye Solutions,https://www.crunchbase.com/organization/3d-eye-solutions,"3D Technology, Digital Signage","3D Eye Solutions is a service provider, developer and integrator for the 3D Stereo and Auto-stereo media industry.","Longwood, Florida, United States",80421,,,Nov-50,2,IPO,4/6/2010,"$210,000.00 ",Venture - Series Unknown,"$380,000.00 ",,,Made Acquisitions,Active
54,,,278,1,0,1,3D FUTURE VISION II,https://www.crunchbase.com/organization/3d-future-vision-ii,"3D Technology, Electronics, Telecommunications",3D Future Vision II,"Longwood, Florida, United States",88389,,,10-Jan,2,,3/21/2013,"$124,000.00 ",Venture - Series Unknown,"$503,000.00 ",,,,Closed
55,,,279,1,0,1,"3D Nano Batteries,LLC",https://www.crunchbase.com/organization/3d-nano-batteries-llc,,"We have the worlds most advanced 3D Carbon Nano tube tech for batteries, Its a 3 dimensional Carbon Nano Sponge.","West Palm Beach, Florida, United States",128697,,,,,,,,,,,,,
56,,,280,1,0,1,3D Practice,https://www.crunchbase.com/organization/3d-practice,,Providing software Products  and services for patient Education.,"Tampa, Florida, United States",336674,,,,,,,,,,,,,Active
57,,,281,1,0,1,3D Tek Executive Search Firm,https://www.crunchbase.com/organization/3d-tek-executive-search-firm,,"3D Tek is a boutique executive search firm, providing staffing solutions on retained, contract, temp to hire and direct / permanent hire.","Bushnell, Florida, United States",386778,,,Nov-50,,,,,,,,,,Active
58,,,282,1,0,1,3dCart Shopping Cart Software,https://www.crunchbase.com/organization/3dcart-shopping-cart-software,"E-Commerce, Web Design, Web Development",3DCart provides an easy-to-use e-commerce solution suite to design any type of online business portals.,"Lauderhill, Florida, United States",32011,,,51-100,1,Seed,1/1/2010,"$1,250,000.00 ",Angel,"$1,250,000.00 ",,,,Active
59,,,283,1,0,0,3DVIX,https://www.crunchbase.com/organization/3dvix,E-Commerce,3DVIX is an online shopping website that distributes 3D-printed objects.,"Miami, Florida, United States",286788,,,10-Jan,,,,,,,,,,Active
60,,,284,1,0,1,3G1V,https://www.crunchbase.com/organization/3g1v,"GreenTech, Recycling",Recycling Styrofoam and sell to China,"Tampa, Florida, United States",284942,,,10-Jan,,,,,,,,,,Active
61,,,285,1,0,1,3M Electronic Monitoring,https://www.crunchbase.com/organization/3m-electronic-monitoring,"Electronics, Manufacturing","3M Electronic Monitoring designs, develops, manufactures, and supplies presence and location verification technologies.","Odessa, Florida, United States",459346,,,,,M&A,,,,,,,Was Acquired,Active
62,,,286,1,0,1,3mindware,https://www.crunchbase.com/organization/3mindware,"Hardware, Software, Web Design",We are an experienced web design firm capable of handling projects of any size.Check out our Website and see for yourself.,"Miami, Florida, United States",385702,,,10-Jan,,,,,,,,,,Active
63,,,287,1,0,1,3rd Eye Thermography Holistic Center,https://www.crunchbase.com/organization/3rd-eye-thermography-holistic-center,,3rd Eye Thermography Holistic Center,"Fort Lauderdale, Florida, United States",497202,,,,,,,,,,,,,Active
64,,,288,1,0,1,401kexchange,https://www.crunchbase.com/organization/401kexchange,B2B,Welcome to the world's only objective online 401(k) industry exchange and due diligence service.,"Lake Worth, Florida, United States",206896,,,51-100,1,,2/15/2000,"$3,100,000.00 ",Venture - Series Unknown,"$3,100,000.00 ",2,4,,Closed
65,,,289,1,0,1,"4A Labs, LLC.",https://www.crunchbase.com/organization/4a-labs-llc,Consulting,"A fully integrated innovative IT consulting, Software D&D House and Creative Design Agency that blends Technology & Creativity brilliantly.","Miami, Florida, United States",154457,,,Nov-50,,,,,,,,,,Active
66,,,290,1,0,1,4th Generation Organic Market,https://www.crunchbase.com/organization/4th-generation-organic-market,,"4th Generation Organic Market is the only location in Palm Beach County catering to vegans, vegetarians, and raw foodies.","Boca Raton, Florida, United States",317553,,,,,,,,,,,,,Active
67,,,291,1,0,1,4Voice,https://www.crunchbase.com/organization/4voice,,4Voice LLC is a Hosted Business VoIP Phone Service Provider.,"Boca Raton, Florida, United States",345562,,,Nov-50,,,,,,,,,,Active
68,,,292,1,0,0,4WheelOnline,https://www.crunchbase.com/organization/4wheelonline,"Automotive, Consumer, Hardware",4 Wheel Online offers the best truck accessories for all of your off-road needs with the lowest prices and free shipping.,"Tampa, Florida, United States",294452,,,Nov-50,,,,,,,,,,Active
69,,,293,1,0,0,"4Women.com, Inc.",https://www.crunchbase.com/organization/4women-com-inc,,4Women.com is a women's scarf development company that designs and manufactures scarves for women going bald due to sickness.,"Florida, United States, North America",74050,,,10-Jan,1,,6/1/2017,"$20,000.00 ",Grant,"$20,000.00 ",,,,Active
70,,,294,1,0,1,5 Bars,https://www.crunchbase.com/organization/5-bars,Wireless,5 Bars Monetize Your Wireless Coverage.,"Boynton Beach, Florida, United States",196229,,,Nov-50,,M&A,,,,,,,Was Acquired,Active
71,,,295,1,0,0,5 Star Auto Sales and Repair,https://www.crunchbase.com/organization/5-star-auto-sales-and-repair,Automotive,5 Star Auto Sales and Repair provide services in auto repair and used auto sales.,"Spring Hill, Florida, United States",353254,,,10-Jan,,,,,,,,,,Closed
72,,,296,1,0,1,5 Star Mobile,https://www.crunchbase.com/organization/5-star-mobile,"Consumer Electronics, Mobile Devices",Our mission is to provide Verizon Wireless products and services with a commitment to exceptional.,"Fort Lauderdale, Florida, United States",59518,,,10-Jan,1,,2/20/2014,"$180,000.00 ",Equity Crowdfunding,"$180,000.00 ",,,,Active
73,,,297,1,0,1,5 Star Painting LLC,https://www.crunchbase.com/organization/ariel-flores,Home Decor,"5 Star Painting offers furniture refinishing, floor staining, screen replacing, pressure washing, and painting services for their clients.","Destin, Florida, United States",468009,,,,,,,,,,,,,Active
74,,,298,1,0,1,54Energy,https://www.crunchbase.com/organization/hermes-energy,E-Commerce,54Energy – Renewable Energy Store,"Miami, Florida, United States",191931,,,,,,,,,,,,,Active
75,,,299,1,0,1,561 Media,https://www.crunchbase.com/organization/561-media,"Advertising, Digital Marketing, Marketing, SEM, SEO",Full-service and in-house custom website design and Digital marketing SEO agency located in Boca Raton Florida.,"Boca Raton, Florida, United States",171398,,,Nov-50,,,,,,,,,,Active
76,,,300,1,0,1,5Four Digital,https://www.crunchbase.com/organization/5four-digital,"Advertising, Analytics, Digital Marketing",Innovative Digital Marketing Services,"Pembroke Pines, Florida, United States",177314,,,10-Jan,,,,,,,,,,Active
77,,,301,1,0,1,5i Solutions,https://www.crunchbase.com/organization/5i-solutions,Software,"5i Solutions provides multiple tools and solutions for digitizing, processing and managing documents for multiple markets.","Fort Lauderdale, Florida, United States",181327,,,Nov-50,,,,,,,,,Made Acquisitions,Active
78,,,302,1,0,1,5nine Software,https://www.crunchbase.com/organization/5nine-software,"Information Technology, Security, Virtualization",5nine Software is the global Hyper-V virtualization management and security provider.,"West Palm Beach, Florida, United States",74445,,,101-250,1,,11/19/2014,,Venture - Series Unknown,,,3,,Active
79,,,303,1,0,1,5th Avenue Acquisitions & Venture Capitalists,https://www.crunchbase.com/organization/5th-avenue-acquisitions-venture-capitalists,"Financial Services, Venture Capital","5th Avenue Acquisitions & Venture Capitalists provides bond funds in industries such as mining/oil/gas, medical/dental, communications, ect.","Naples, Florida, United States",174760,,,10-Jan,,,,,,,,,,Active
80,,,304,1,0,1,64bithost.com,https://www.crunchbase.com/organization/64bithost-com,"Service Industry, Web Hosting","VPS, Shared Hosting, Dedicated Hosting","Gainesville, Florida, United States",284262,,,10-Jan,,,,,,,,,Made Acquisitions,Active
81,,,305,1,0,1,71lbs,https://www.crunchbase.com/organization/71lbs,"Analytics, Network Security, Shipping, Small and Medium Businesses",71lbs provides analytics and reporting tools that help small and medium businesses save money on shipping.,"Fort Lauderdale, Florida, United States",27127,,,10-Jan,6,Seed,6/8/2014,"$2,000,000.00 ",Angel,"$2,400,000.00 ",,7,,Active
82,,,306,1,0,0,734 Citrus Holdings,https://www.crunchbase.com/organization/734-citrus-holdings,,734 Citrus Holdings is a producer of citrus products in Florida.,"Frostproof, Florida, United States",356063,,,,,M&A,,,,,,,Was Acquired,Active
83,,,307,1,0,0,800 Travel Systems,https://www.crunchbase.com/organization/800-travel-systems,Travel,800 Travel Systems is a destination management company that provides low-priced airline tickets for domestic and international travels.,"Tampa, Florida, United States",556277,,,,,IPO,,,,,,,,Active
84,,,308,1,0,1,800.COM,https://www.crunchbase.com/organization/800-com,"Information Technology, Mobile, Telecommunications","800.COM has been providing excellent products, services and customer care for 10 years.","Longboat Key, Florida, United States",97843,,,51-100,2,,6/12/2001,"$20,000,000.00 ",Venture - Series Unknown,"$77,000,000.00 ",2,13,,Active
85,,,309,1,0,1,805Stats,https://www.crunchbase.com/organization/805stats,"Information Technology, Sports","805Stats is a cutting-edge sports and game data software platform and app that provides the best in scorekeeping, game capturing.","Boynton Beach, Florida, United States",495836,,,Nov-50,,,,,,,,,,Active
86,,,310,1,0,1,83 Degrees Media,https://www.crunchbase.com/organization/83-degrees-media,,"83 Degrees Media tells the stories of urban and emerging neighborhoods, community building, placemaking, entrepreneurship, creativity, arts.","Tampa, Florida, United States",389897,,,Nov-50,,,,,,,,,,Active
87,,,311,1,0,1,8base,https://www.crunchbase.com/organization/8base-2,,8base is a a company inventing the future of software.,"Coral Gables, Florida, United States",77078,,,Nov-50,,,,,,,,,,Active
88,,,312,1,0,1,8BitBandits,https://www.crunchbase.com/organization/8bitbandits,"Mobile, Mobile Apps, Online Games, Video Games","8BitBandits is an independent developer based out of Orlando, Florida.","Winter Park, Florida, United States",226133,,,10-Jan,,,,,,,,,,Active
89,,,313,1,0,1,8K Solutions,https://www.crunchbase.com/organization/8k-solutions,Sports,8K Solutions is to leverage their decades of sport technology experience to provide innovative products.,"Titusville, Florida, United States",274874,,,10-Jan,,,,,,,,,,Active
90,,,314,1,0,1,911 Boost,https://www.crunchbase.com/organization/911-boost,Mobile,The Ultimate Portable Emergency Phone Charger on a Convenient Key Chain!,"Fort Lauderdale, Florida, United States",364156,,,,,,,,,,,,,Active
91,,,315,1,0,1,911 Home Experts,https://www.crunchbase.com/organization/911-home-experts,,"Fast, Affordable… for all your Ft Lauderdale Home service and repairs!","Fort Lauderdale, Florida, United States",380764,,,10-Jan,,,,,,,,,,Active
